[
  {
    "strategy_id": "strategy-ROI_Value_Driven",
    "hypothesis": "소비자는 매일 복용해야 하는 영양제의 고정 유지 비용에 부담을 느낀다. 커피값과 비교하여 '하루 500원'이라는 압도적인 가성비를 숫자로 시각화하면 구매에 대한 심리적 저항을 크게 낮출 수 있다.",
    "approach": "턴 1 (오프닝): \"매일 챙겨 드시는 영양제, 한 달 유지 비용이 은근히 부담되지 않으신가요?\"\n턴 2 (핵심 가치): \"바이탈케어는 하루 500원으로 커피 한 잔 값의 10분의 1도 안 됩니다. 그런데 이 한 알에 피로회복을 위한 비타민 B군 고함량부터 눈 건강을 위한 루테인, 면역력을 돕는 아연까지 꽉 채워져 있어요.\"\n턴 3 (클로징): \"가성비가 워낙 좋아서 2개월분(29,900원)부터 가볍게 시작해 보시는 걸 추천드리는데, 30일 내 불만족 시 환불도 가능하니 부담 없이 한 달만 드셔보시겠어요?\"",
    "opening_style": "유지 비용에 대한 공감을 이끌어내며 호기심을 자극하는 질문",
    "objection_handling": "고객 반론: '너무 저렴해서 성분이나 품질이 떨어지는 것 아닐까요?' -> 대응: '유통 과정을 줄여 가격을 낮췄을 뿐, 국가에서 인증한 국내 GMP 공장에서 엄격하게 생산됩니다. 30일 환불 보장이 그 품질의 증거입니다.'",
    "tone": "이성적이고 명쾌하며 합리적인 톤"
  },
  {
    "strategy_id": "strategy-Emotional_Empathy_All_in_one",
    "hypothesis": "직장인과 학생들은 만성 피로와 모니터로 인한 눈의 피로를 동시에 겪고 있지만, 여러 종류의 영양제를 챙겨 먹는 것을 귀찮아한다. 일상의 피로에 공감하고 '단 한 알'의 편리함을 강조하면 자연스러운 구매로 이어진다.",
    "approach": "턴 1 (오프닝): \"요즘 오후 3~4시쯤 되면 모니터 보실 때 눈도 뻑뻑하고 몸이 무겁게 가라앉지 않으신가요?\"\n턴 2 (핵심 가치): \"다들 그 시간대가 제일 힘들다고 하시더라고요. 그래서 피로를 깨워주는 고함량 비타민B와 눈 뻑뻑함을 줄여주는 루테인을 하나로 합쳤습니다. 바쁜 아침, 식사하시고 딱 한 알만 드시면 오후 컨디션이 훨씬 가벼워지실 거예요.\"\n턴 3 (클로징): \"이것저것 챙길 필요 없이 내일 아침부터 딱 한 알만 드셔보시겠어요? 30일 동안 꾸준히 드셔보시고 변화가 없다면 100% 환불해 드리겠습니다.\"",
    "opening_style": "특정 시간대의 피로감(오후 3-4시, 눈의 뻑뻑함)을 짚어주는 깊은 공감형 질문",
    "objection_handling": "고객 반론: '이미 집에 사둔 영양제가 너무 많아서 또 사기 부담스러워요.' -> 대응: '여러 통 열었다 닫았다 하시기 번거로우시죠? 기존 제품들 다 드실 필요 없이, 당분간 이 올인원 한 알로 간편하게 아침 시간을 줄여보세요.'",
    "tone": "따뜻하고 이해심 많으며 편안한 톤"
  },
  {
    "strategy_id": "strategy-Expert_Authority_Trust",
    "hypothesis": "건강기능식품 관여도가 높은 소비자는 제품의 안전성과 성분 배합의 전문성을 중시한다. GMP 인증과 최적의 성분 배합을 근거로 제시하고, 환불 보장을 통해 구매 실패에 대한 손실 회피 심리를 자극하면 신뢰를 극대화할 수 있다.",
    "approach": "턴 1 (오프닝): \"건강하려고 먹는 영양제, 성분 배합과 제조 시설 인증 마크까지 꼼꼼하게 확인하고 고르시나요?\"\n턴 2 (핵심 가치): \"바이탈케어는 식약처 우수건강기능식품 제조기준인 GMP 인증 시설에서 안전하게 생산됩니다. 특히 한국인에게 가장 부족하기 쉬운 비타민D와 아연의 면역 조합에, 피로회복 B군을 고함량으로 빈틈없이 배합했습니다.\"\n턴 3 (클로징): \"내 몸에 직접 들어가는 건데, 직접 경험해 보시는 게 가장 확실하죠. 품질에 대한 자신감으로 30일 전액 환불을 보장해 드리고 있으니, 리스크 없이 안전하게 시작해 보시겠어요?\"",
    "opening_style": "건강 관리에 대한 기준을 묻고 전문성을 암시하는 질문",
    "objection_handling": "고객 반론: '처음 들어보는 브랜드라 믿고 먹어도 될지 걱정되네요.' -> 대응: '브랜드 인지도보다 중요한 것은 정확한 성분과 제조 시설입니다. GMP 마크로 1차 검증을 마쳤고, 30일 환불 보장 제도로 고객님의 불안감을 100% 덜어드리고 있습니다.'",
    "tone": "전문적이고 자신감 있으며 신뢰감을 주는 톤"
  }
]