[
  {
    "strategy_id": "strategy-ROI_SIMPLIFICATION",
    "hypothesis": "하루 500원이라는 저렴한 비용과 한 알로 여러 영양제를 대체하는 편의성을 강조하면, 고객의 금전적 및 행동적 진입장벽을 동시에 제거할 수 있다.",
    "approach": "비용 대비 가치를 숫자로 명확히 제시합니다. '하루 500원'으로 피로, 면역, 눈 건강을 모두 챙길 수 있음을 강조하고, 여러 병을 챙겨 먹는 번거로움 없이 아침 식후 1정이면 끝난다는 점을 부각하여 복잡한 영양제 선택을 단순화합니다.",
    "opening_style": "고객님, 매달 영양제 구매에 얼마 정도 쓰시나요? 하루 딱 500원만 투자하면 책상 위의 복잡한 영양제 병들을 이 한 알로 싹 정리할 수 있는 방법을 알려드릴게요.",
    "objection_handling": "가격이 너무 저렴해서 품질이 의심된다고 하실 수 있습니다. 하지만 이 제품은 유통 마진을 줄여 고객님께 혜택을 돌려드린 결과입니다. 식약처 우수건강기능식품 제조기준인 국내 GMP 인증 공장에서 안전하게 생산되며, 품질에 대한 자신감으로 30일 전액 환불을 보장해 드리고 있습니다.",
    "tone": "논리적이고 명쾌하며, 경제적 이점과 효율성을 강조하는 스마트한 톤"
  },
  {
    "strategy_id": "strategy-EMPATHY_LOSS_AVERSION",
    "hypothesis": "직장인과 학생의 만성 피로와 눈의 뻑뻑함에 깊이 공감하고, 이를 방치했을 때 잃게 되는 일상의 활력을 상기시키면 감정적인 구매 동기를 강력하게 유발할 수 있다.",
    "approach": "아침에 일어날 때의 무거움, 오후 3시 모니터 앞에서의 눈 피로 등 구체적인 상황을 묘사하며 공감대를 형성합니다. 지금 관리하지 않으면 누적된 피로로 인해 황금 같은 주말까지 무기력하게 보내게 된다는 '손실'을 짚어주고, 30일 환불 보장으로 구매 리스크를 완전히 없애 결제를 유도합니다.",
    "opening_style": "요즘 아침에 알람이 울릴 때 몸이 천근만근 무겁지 않으신가요? 특히 오후만 되면 모니터 보실 때 눈도 많이 뻑뻑하고 피곤하시죠.",
    "objection_handling": "영양제를 먹어도 그때뿐이거나 효과를 잘 모르겠다고 말씀하실 수 있습니다. 기존에 드시던 제품에 피로회복 핵심인 '비타민 B군'이 고함량으로 들어있었는지 확인해 보셨나요? 이 제품은 현대인의 피로 패턴에 맞춰 B군을 고함량으로 꽉 채웠습니다. 한 달 드셔보시고 아침이 달라지지 않는다면 100% 환불해 드릴 테니, 밑져야 본전으로 시작해 보세요.",
    "tone": "따뜻하고 공감 능력이 뛰어나며, 고객의 일상적인 고충을 진심으로 걱정해 주는 상담가 톤"
  },
  {
    "strategy_id": "strategy-EXPERT_AUTHORITY",
    "hypothesis": "성분의 과학적 배합 원리와 인증된 제조 시설을 강조하면, 건강기능식품 선택에 깐깐한 기준을 가진 소비자의 신뢰를 얻고 이성적 설득이 가능하다.",
    "approach": "피로(비타민 B군), 면역(아연+비타민D), 눈 건강(루테인)이라는 현대인 필수 3대 요소를 최적의 비율로 배합한 '전문적 설계'임을 강조합니다. 국내 GMP 인증 시설 생산이라는 객관적 팩트와 성분 간의 시너지 효과를 설명하여 제품의 권위를 높입니다.",
    "opening_style": "건강기능식품을 고르실 때 성분표와 함량을 꼼꼼히 확인하시는 편인가요? 바쁜 현대인에게 가장 부족해지기 쉬운 3가지 핵심 성분만 식약처 기준에 맞춰 정확하게 배합한 제품을 소개해 드립니다.",
    "objection_handling": "한 알에 너무 여러 성분이 섞여 있어서 흡수율이 떨어지지 않을까 우려하실 수 있습니다. 하지만 영양소 간의 충돌 없이 오히려 시너지를 낼 수 있는 성분들로만 엄선해 배합했습니다. 체내 에너지 생성을 돕는 B군과 정상적인 면역 기능을 돕는 아연이 과학적으로 설계된 국내 GMP 인증 제품이니 안심하고 드셔도 됩니다.",
    "tone": "전문적이고 객관적이며, 데이터와 팩트를 기반으로 확신을 주는 신뢰감 있는 톤"
  }
]