[
  {
    "strategy_id": "strategy-value-simplicity",
    "hypothesis": "바쁜 현대인은 시간과 비용 효율성을 중시하며, 복잡한 건강 관리를 단순화하고 싶어 합니다. 하루 500원이라는 저렴한 비용으로 여러 가지 건강 고민을 한 번에 해결할 수 있다는 점을 강조하여, 경제성과 편의성이라는 두 마리 토끼를 잡으려는 심리를 공략합니다.",
    "approach": "제품의 '하루 약 500원'이라는 저렴한 일일 비용과 '피로, 면역, 눈 건강'을 한 번에 챙길 수 있는 '올인원' 특성을 강조합니다. 여러 영양제를 따로 챙길 필요 없이 간편하게 건강을 관리할 수 있다는 점을 부각하여 가성비와 편의성을 동시에 어필합니다.",
    "opening_style": "바쁜 일상 속에서 내 몸 챙기기 힘드시죠? 혹시 하루 커피 한 잔 값도 안 되는 500원으로 피로, 면역, 눈 건강까지 한 번에 관리할 수 있다면 어떠세요?",
    "objection_handling": "(비타민이 너무 많아요/뭘 골라야 할지 모르겠어요) 맞아요, 시중에 비타민 종류가 너무 많아서 선택하기 어렵죠. 바이탈케어는 복잡하게 여러 개 챙길 필요 없이, 현대인의 핵심 고민인 피로, 면역, 눈 건강에 필요한 성분을 딱 한 알에 담았어요. 오히려 여러 개 챙기던 번거로움을 줄여드릴 거예요.",
    "tone": "실용적, 효율적, 친절하고 명쾌함"
  },
  {
    "strategy_id": "strategy-empathy-solution",
    "hypothesis": "20-50대 직장인/학생은 만성 피로, 잦은 야근으로 인한 눈의 피로, 스트레스로 인한 면역력 저하 등 구체적인 건강 고민을 안고 있습니다. 이러한 고객의 고통과 불편함에 깊이 공감하고, 제품이 그 문제에 대한 직접적이고 효과적인 해결책임을 제시하여 구매 필요성을 자극합니다.",
    "approach": "고객의 일상적인 불편함(만성 피로, 눈의 뻑뻑함, 감기 등)을 먼저 언급하며 공감대를 형성한 후, 바이탈케어의 핵심 성분(비타민 B군, 루테인, 아연+비타민D)이 이러한 문제를 어떻게 해결하는지 구체적으로 설명합니다.",
    "opening_style": "혹시 요즘 아침에 일어나기 힘드시고, 컴퓨터나 스마트폰 보느라 눈도 뻑뻑하고, 면역력도 약해진 것 같다는 생각 해보신 적 있으세요? 바쁜 현대인이라면 누구나 겪는 고민일 텐데요.",
    "objection_handling": "(영양제 효과를 잘 모르겠어요) 네, 많은 분들이 영양제 효과에 대해 궁금해하시죠. 바이탈케어는 단순히 '좋다'가 아니라, 특히 현대인에게 부족하기 쉬운 비타민 B군을 고함량으로 담아 피로 회복에 집중하고, 루테인으로 눈 건강을, 아연과 비타민D로 면역력을 강화하여 고객님의 실제 불편함에 딱 맞는 솔루션을 제공합니다. 꾸준히 드시면 분명 몸의 변화를 느끼실 수 있을 거예요.",
    "tone": "공감적, 이해심 많고, 문제 해결에 적극적인 태도"
  },
  {
    "strategy_id": "strategy-trust-risk-reversal",
    "hypothesis": "건강기능식품에 대한 소비자의 불신이나 효과에 대한 의구심이 존재합니다. GMP 인증, 특정 성분의 과학적 근거, 그리고 30일 환불 보장이라는 강력한 안전장치를 제시하여 신뢰를 구축하고, 구매 결정에 따르는 위험을 제거함으로써 구매를 유도합니다.",
    "approach": "제품의 국내 GMP 인증, 각 성분(비타민 B군, 아연, 비타민D, 루테인)의 기능에 대한 전문적인 설명을 통해 제품의 품질과 효과에 대한 신뢰를 높입니다. 마지막으로 '30일 환불 보장'을 강조하여 고객이 아무런 부담 없이 제품을 경험해볼 수 있도록 유도합니다.",
    "opening_style": "내 몸에 직접 닿는 제품인 만큼, 어떤 기준으로 신뢰할 수 있는 비타민을 고를지 고민이 많으실 텐데요. 바이탈케어가 왜 믿을 수 있는지 핵심적인 부분을 먼저 말씀드릴게요.",
    "objection_handling": "(혹시 저한테 안 맞으면 어쩌죠?) 그 점이 가장 중요하죠. 그래서 저희는 제품력에 대한 자신감으로 '30일 환불 보장' 제도를 운영하고 있습니다. 국내 GMP 인증 시설에서 엄격하게 생산되었고, 수많은 연구를 통해 검증된 성분들을 최적의 배합으로 담았기에 효과를 직접 경험해보시길 권해드립니다. 만약 만족하지 못하신다면 언제든 환불해드리니, 아무 부담 없이 바이탈케어를 경험해보세요.",
    "tone": "전문적, 확신에 찬, 신뢰를 주는, 고객 중심적"
  }
]