[
  {
    "strategy_id": "strategy-strategy_1_empathy_simplicity",
    "hypothesis": "만성 피로에 시달리지만 복잡한 관리는 귀찮아하는 고객에게, 현재의 피로감에 공감해 주고 해결책을 극도로 단순화하여 제시하면 심리적 진입 장벽이 낮아질 것이다.",
    "approach": "대화를 통해 고객의 주요 불편함을 파악합니다. 바쁜 일상을 호소한다면(시간 부족형): '여러 종류의 영양제를 따로 챙길 필요 없이, 아침 식사 직후 물 한 잔과 함께 딱 1정이면 끝납니다'라며 아침 루틴 편입의 용이성을 강조합니다. 만약 특정 증상에 관심을 보인다면(건강 관심형): '피로 회복에 직결되는 비타민 B군과 모니터를 오래 봐서 생기는 눈 피로를 덜어주는 루테인이 올인원으로 배합되어 있습니다'라고 구체적인 해결책을 매칭합니다.",
    "opening_style": "최근 들어 아침에 일어날 때 몸이 평소보다 무겁거나, 오후쯤 눈이 뻑뻑하다고 느끼신 적 있으신가요?",
    "objection_handling": "영양제 챙겨 먹는 걸 자꾸 까먹게 돼요. -> 아침 식사하시고 물 드실 때 바로 옆에 두시면 됩니다. 하루에 두세 번 챙길 필요 없이 아침에 딱 한 번만 드시면 되기 때문에 며칠만 지나면 양치질처럼 자연스러운 습관이 됩니다.",
    "tone": "부드럽고 공감하며, 부담을 덜어주는 편안한 톤"
  },
  {
    "strategy_id": "strategy-strategy_2_roi_risk_reversal",
    "hypothesis": "가성비를 중시하거나 제품의 효과를 의심하는 고객에게, 일상적인 지출(커피)과의 구체적인 비용 비교와 100% 환불 보장을 통한 리스크 제거를 제공하면 구매 결정이 촉진될 것이다.",
    "approach": "고객이 가격에 대해 머뭇거린다면(예산 민감형): '2개월분에 29,900원이니 하루 500원꼴입니다. 매일 드시는 아메리카노 한 잔 값으로 9일 치 피로 회복을 챙길 수 있습니다'라고 비용을 분해하여 프레이밍합니다. 고객이 효과에 의구심을 표한다면(분석형/회의형): '말로만 피로가 풀린다고 하지 않겠습니다. 30일 동안 드셔보시고 아침이 가벼워지는 느낌이 없다면 전액 환불해 드립니다'라며 구매에 따른 손실 위험을 완전히 제거합니다.",
    "opening_style": "피곤하실 때 습관적으로 커피나 에너지 음료를 찾으시나요? 하루에 음료값으로 대략 얼마 정도 쓰시는지 궁금합니다.",
    "objection_handling": "그래도 2개월 치를 한 번에 사는 건 좀 부담스러운데요. -> 그래서 30일 환불 보장 제도가 있습니다. 일단 한 달을 꾸준히 드셔보시고, 본인 몸에 맞는지 직접 확인하신 뒤에 최종 결정을 하셔도 고객님께는 전혀 손해가 없습니다.",
    "tone": "명확하고 논리적이며, 확신에 찬 톤"
  },
  {
    "strategy_id": "strategy-strategy_3_authority_differentiation",
    "hypothesis": "건강기능식품 선택 시 근거와 신뢰도를 중시하는 고객에게, 공인된 인증과 성분 배합의 과학적 차별점을 제시하면 긍정적인 반응을 이끌어낼 것이다.",
    "approach": "고객이 성분이나 효과의 근거를 꼼꼼히 따진다면(분석형): '일반 비타민과 달리, 피로 회복을 위한 비타민 B군이 고함량으로 들어있고, 면역력을 돕는 아연과 비타민D, 눈 건강용 루테인이 겹치지 않게 설계되었습니다'라며 타사 대비 구체적인 차이점을 설명합니다. 제조 과정의 안전성을 중시한다면(권위 신뢰형): '식약처에서 우수 건강기능식품 제조 기준으로 인정한 국내 GMP 시설에서 생산되어, 라벨에 적힌 성분 함량이 100% 보장됩니다'라고 권위를 활용해 안심시킵니다.",
    "opening_style": "혹시 지금 드시고 계신 영양제의 뒷면 라벨에서 'GMP 인증 마크'나 성분별 함량을 꼼꼼히 확인해 보신 적 있으신가요?",
    "objection_handling": "이미 집에서 먹고 있는 종합 비타민이 있어서요. -> 지금 드시는 제품에 피로 회복 핵심인 B군이 고함량인지, 그리고 루테인까지 포함되어 있는지 한 번 비교해 보세요. 눈 영양제와 비타민을 따로 구매하고 챙겨 먹는 수고와 비용을 이 한 병으로 깔끔하게 줄일 수 있습니다.",
    "tone": "전문적이고 객관적이며, 신뢰감을 주는 톤"
  }
]